### ISSUE TITLE
SearchList is added into the wrong place in registory

### ISSUE THREAD

**Issue by lstipakov** [OpenVPN/openvpn#749]
The code adds SearchList under interface-specific key:

```
Windows Registry Editor Version 5.00

[HKEY_LOCAL_MACHINE\SYSTEM\CurrentControlSet\Services\Tcpip\Parameters\Interfaces\{da14662c-9e5b-47d8-bd9e-21bfafedf2b4}]
"EnableDHCP"=dword:00000001
"Domain"=""
"NameServer"="1.1.1.1"
"SearchList"="dom1.com"
"DhcpServer"="255.255.255.255"
"Lease"=dword:00000000
"LeaseObtainedTime"=dword:682b35d4
"T1"=dword:682b35d4
"T2"=dword:682b35d4
"LeaseTerminatesTime"=dword:682b35d4
"AddressType"=dword:00000000
"IsServerNapAware"=dword:00000000
"DhcpConnForceBroadcastFlag"=dword:00000000
"IPAddress"=hex(7):00,00
"SubnetMask"=hex(7):00,00
"RegistrationEnabled"=dword:00000001
"RegisterAdapterName"=dword:00000000
"DhcpIPAddress"="0.0.0.0"
"DhcpSubnetMask"="255.0.0.0"
```

However this is incorrect and doesn't work. The comma-separated list should go under `Tcpip\Parameters` instead.

**Comment by lstipakov** [comment]
Interesting, even with `SearchList` being at Parameters level it is still not used.

```
PS C:\Users\lev> Get-DnsClientGlobalSetting

UseSuffixSearchList : False
SuffixSearchList    : {}
UseDevolution       : True
DevolutionLevel     : 0
```

**Comment by d12fk** [comment]
Something seems to be off on your system. I have OpenVPN configured to push quad-nine as DNS server, with two search domains:
```
push "dns search-domains mydomain.in myotherdomain.net"
push "dns server 5 address 9.9.9.9"
push "route 9.9.9.9 255.255.255.255"
```
and the search domains show as adapter specific configuration, as well as in the global "collected" list when the tunnel is established:
```
PS C:\Users\Heiko\src\openvpn> ipconfig -all

Windows IP Configuration

   Host Name . . . . . . . . . . . . : DESKTOP-RKVFERD
   Primary Dns Suffix  . . . . . . . : foo.bar.baz.net
   Node Type . . . . . . . . . . . . : Hybrid
   IP Routing Enabled. . . . . . . . : No
   WINS Proxy Enabled. . . . . . . . : No
   DNS Suffix Search List. . . . . . : foo.bar.baz.net
                                       mydomain.in
                                       myotherdomain.net
                                       fritz.box

Unknown adapter OpenVPN Data Channel Offload:

   Connection-specific DNS Suffix  . : dco.domain
   Description . . . . . . . . . . . : OpenVPN Data Channel Offload
   Physical Address. . . . . . . . . :
   DHCP Enabled. . . . . . . . . . . : Yes
   Autoconfiguration Enabled . . . . : Yes
   IPv6 Address. . . . . . . . . . . : fd00::1000(Preferred)
   Link-local IPv6 Address . . . . . : fe80::52a7:d495:39b5:1dc9%10(Preferred)
   IPv4 Address. . . . . . . . . . . : 172.16.0.2(Preferred)
   Subnet Mask . . . . . . . . . . . : 255.255.255.0
   Default Gateway . . . . . . . . . :
   DHCPv6 IAID . . . . . . . . . . . : 168296487
   DHCPv6 Client DUID. . . . . . . . : 00-01-00-01-29-55-94-6C-08-00-27-47-96-74
   DNS Servers . . . . . . . . . . . : 9.9.9.9
   NetBIOS over Tcpip. . . . . . . . : Enabled
   Connection-specific DNS Suffix Search List :
                                       mydomain.in
                                       myotherdomain.net
```

Doing hostname (non-FQDN) lookups on Windows, I see DNS queries on the OpenVPN server's tun interface for the domains that were pushed (and the primary domain):
```
# tcpdump -ni tun0 udp port 53
tcpdump: verbose output suppressed, use -v[v]... for full protocol decode
listening on tun0, link-type RAW (Raw IP), snapshot length 262144 bytes
13:54:47.995276 IP 172.16.0.2.58063 > 9.9.9.9.53: 31199+ A? foobar.foo.bar.baz.net. (40)
13:54:48.080790 IP 9.9.9.9.53 > 172.16.0.2.58063: 31199 NXDomain 0/1/0 (100)
13:54:48.081737 IP 172.16.0.2.60486 > 9.9.9.9.53: 23057+ A? foobar.mydomain.in. (36)
13:54:48.342280 IP 9.9.9.9.53 > 172.16.0.2.60486: 23057 NXDomain 0/1/0 (116)
13:54:48.343159 IP 172.16.0.2.50046 > 9.9.9.9.53: 52640+ A? foobar.myotherdomain.net. (42)
13:54:49.346337 IP 9.9.9.9.53 > 172.16.0.2.50046: 52640 ServFail 0/0/0 (42)
```

Could you check again please if your system shows any different status to what this Windows 10 shows?

**Comment by d12fk** [comment]
Is the adapter specific `SearchList` displayed in `ipconfig -all` output?

**Comment by lstipakov** [comment]
It is displayed and contains VPN-pushed DNS suffix (`dom1.com`), however it has no effect. Only way I was able to make it work is to add to the global `SearchList`.

```
PS C:\Users\lev> ipconfig /all

Configuración IP de Windows

   Nombre de host. . . . . . . . . : lev-x1-11
   Sufijo DNS principal  . . . . . :
   Tipo de nodo. . . . . . . . . . : híbrido
   Enrutamiento IP habilitado. . . : no
   Proxy WINS habilitado . . . . . : no
   Lista de búsqueda de sufijos DNS: mydomain1.com
                                       mydomain2.com

Adaptador de Ethernet vEthernet (Default Switch):

   Sufijo DNS específico para la conexión. . :
   Descripción . . . . . . . . . . . . . . . : Hyper-V Virtual Ethernet Adapter
   Dirección física. . . . . . . . . . . . . : 00-15-5D-12-98-01
   DHCP habilitado . . . . . . . . . . . . . : no
   Configuración automática habilitada . . . : sí
   Vínculo: dirección IPv6 local. . . : fe80::eef8:c300:9a2:ee16%53(Preferido)
   Dirección IPv4. . . . . . . . . . . . . . : 172.28.160.1(Preferido)
   Máscara de subred . . . . . . . . . . . . : 255.255.240.0
   Puerta de enlace predeterminada . . . . . :
   IAID DHCPv6 . . . . . . . . . . . . . . . : 889197917
   DUID de cliente DHCPv6. . . . . . . . . . : 00-01-00-01-2E-03-4D-50-10-F6-0A-7B-68-8F
   NetBIOS sobre TCP/IP. . . . . . . . . . . : habilitado

Adaptador de Ethernet vEthernet (Sisäverkko):

   Sufijo DNS específico para la conexión. . :
   Descripción . . . . . . . . . . . . . . . : Hyper-V Virtual Ethernet Adapter #2
   Dirección física. . . . . . . . . . . . . : 00-15-5D-12-99-07
   DHCP habilitado . . . . . . . . . . . . . : no
   Configuración automática habilitada . . . : sí
   Dirección IPv6 . . . . . . . . . . : fd::1(Preferido)
   Vínculo: dirección IPv6 local. . . : fe80::4420:460a:1a5a:721d%25(Preferido)
   Dirección IPv4. . . . . . . . . . . . . . : 192.168.100.1(Preferido)
   Máscara de subred . . . . . . . . . . . . : 255.255.255.0
   Puerta de enlace predeterminada . . . . . :
   IAID DHCPv6 . . . . . . . . . . . . . . . : 285218141
   DUID de cliente DHCPv6. . . . . . . . . . : 00-01-00-01-2E-03-4D-50-10-F6-0A-7B-68-8F
   NetBIOS sobre TCP/IP. . . . . . . . . . . : habilitado

Adaptador desconocido OpenVPN TAP-Windows6:

   Estado de los medios. . . . . . . . . . . : medios desconectados
   Sufijo DNS específico para la conexión. . :
   Descripción . . . . . . . . . . . . . . . : TAP-Windows Adapter V9
   Dirección física. . . . . . . . . . . . . : 00-FF-01-46-02-CD
   DHCP habilitado . . . . . . . . . . . . . : sí
   Configuración automática habilitada . . . : sí

Adaptador desconocido OpenVPN Data Channel Offload:

   Sufijo DNS específico para la conexión. . : dom1.com
   Descripción . . . . . . . . . . . . . . . : OpenVPN Data Channel Offload
   Dirección física. . . . . . . . . . . . . :
   DHCP habilitado . . . . . . . . . . . . . : sí
   Configuración automática habilitada . . . : sí
   Vínculo: dirección IPv6 local. . . : fe80::dec4:1081:ee17:d07b%20(Preferido)
   Dirección IPv4. . . . . . . . . . . . . . : 10.8.0.2(Preferido)
   Máscara de subred . . . . . . . . . . . . : 255.255.255.0
   Puerta de enlace predeterminada . . . . . :
   IAID DHCPv6 . . . . . . . . . . . . . . . : 554759690
   DUID de cliente DHCPv6. . . . . . . . . . : 00-01-00-01-2E-03-4D-50-10-F6-0A-7B-68-8F
   Servidores DNS. . . . . . . . . . . . . . : 1.1.1.1
   NetBIOS sobre TCP/IP. . . . . . . . . . . : habilitado
   Lista de búsqueda de sufijos DNS específicos de conexión:
                                       dom1.com

Adaptador desconocido OpenVPN Data Channel Offload #1:

   Estado de los medios. . . . . . . . . . . : medios desconectados
   Sufijo DNS específico para la conexión. . :
   Descripción . . . . . . . . . . . . . . . : OpenVPN Data Channel Offload #2
   Dirección física. . . . . . . . . . . . . :
   DHCP habilitado . . . . . . . . . . . . . : sí
   Configuración automática habilitada . . . : sí

Adaptador desconocido OpenVPN TAP-Windows6 #1:

   Estado de los medios. . . . . . . . . . . : medios desconectados
   Sufijo DNS específico para la conexión. . :
   Descripción . . . . . . . . . . . . . . . : TAP-Windows Adapter V9 #2
   Dirección física. . . . . . . . . . . . . : 00-FF-A6-10-97-96
   DHCP habilitado . . . . . . . . . . . . . : sí
   Configuración automática habilitada . . . : sí

Adaptador de LAN inalámbrica Local Area Connection* 1:

   Estado de los medios. . . . . . . . . . . : medios desconectados
   Sufijo DNS específico para la conexión. . :
   Descripción . . . . . . . . . . . . . . . : Microsoft Wi-Fi Direct Virtual Adapter
   Dirección física. . . . . . . . . . . . . : 10-F6-0A-7B-68-90
   DHCP habilitado . . . . . . . . . . . . . : sí
   Configuración automática habilitada . . . : sí

Adaptador de LAN inalámbrica Local Area Connection* 2:

   Estado de los medios. . . . . . . . . . . : medios desconectados
   Sufijo DNS específico para la conexión. . :
   Descripción . . . . . . . . . . . . . . . : Microsoft Wi-Fi Direct Virtual Adapter #2
   Dirección física. . . . . . . . . . . . . : 12-F6-0A-7B-68-8F
   DHCP habilitado . . . . . . . . . . . . . : no
   Configuración automática habilitada . . . : sí

Adaptador de LAN inalámbrica Wi-Fi:

   Sufijo DNS específico para la conexión. . : panoulu.local
   Descripción . . . . . . . . . . . . . . . : Intel(R) Wi-Fi 6E AX211 160MHz
   Dirección física. . . . . . . . . . . . . : 10-F6-0A-7B-68-8F
   DHCP habilitado . . . . . . . . . . . . . : sí
   Configuración automática habilitada . . . : sí
   Dirección IPv6 . . . . . . . . . . : 2a00:4cc1:564:1:ef32:d3b:f26f:4562(Preferido)
   Dirección IPv6 temporal. . . . . . : 2a00:4cc1:564:1:31c2:2285:3e5a:e934(Preferido)
   Vínculo: dirección IPv6 local. . . : fe80::a079:85b4:81d4:cf17%4(Preferido)
   Dirección IPv4. . . . . . . . . . . . . . : 100.72.23.93(Preferido)
   Máscara de subred . . . . . . . . . . . . : 255.240.0.0
   Concesión obtenida. . . . . . . . . . . . : martes, 27 de mayo de 2025 11:29:30
   La concesión expira . . . . . . . . . . . : jueves, 29 de mayo de 2025 11:29:24
   Puerta de enlace predeterminada . . . . . : fe80::5895:4eff:fef7:71c5%4
                                       100.64.0.1
   Servidor DHCP . . . . . . . . . . . . . . : 100.64.0.3
   IAID DHCPv6 . . . . . . . . . . . . . . . : 51443210
   DUID de cliente DHCPv6. . . . . . . . . . : 00-01-00-01-2E-03-4D-50-10-F6-0A-7B-68-8F
   Servidores DNS. . . . . . . . . . . . . . : 100.127.0.1
                                       100.127.0.2
   NetBIOS sobre TCP/IP. . . . . . . . . . . : habilitado
   Lista de búsqueda de sufijos DNS específicos de conexión:
                                       panoulu.local

Adaptador de Ethernet Bluetooth Network Connection:

   Estado de los medios. . . . . . . . . . . : medios desconectados
   Sufijo DNS específico para la conexión. . :
   Descripción . . . . . . . . . . . . . . . : Bluetooth Device (Personal Area Network)
   Dirección física. . . . . . . . . . . . . : 10-F6-0A-7B-68-93
   DHCP habilitado . . . . . . . . . . . . . : sí
   Configuración automática habilitada . . . : sí
```

**Comment by lstipakov** [comment]
Okay, so as we figured out with @d12fk , in order for adapter-specific `SearchList` to work, the `NameServer` should be reachable on that specific adapter. In my case I pushed DNS server `1.1.1.1` which was **not** reachable via VPN, so that adapter-specific `SearchList` hasn't been used. After we routed `1.1.1.1` to VPN, it started to work.

TL;DL In order for adapter-specific `SearchList` to work, an adapter's specific DNS server must be reachable via that adapter. It would be nice to document this behavior in Wiki.
